{
  "schema_version": "1.0.0",
  "feature_id": "naming-clearance-and-research-registry",
  "validation_ids": ["VAL-READY-006", "VAL-READY-007"],
  "milestone": "research-foundation",
  "version": "1.0.0",
  "states": ["draft", "in-review", "accepted", "blocked", "superseded"],
  "deliverables": [
    {
      "id": "RES-STUDY-NAMING-001", "type": "study", "title": "Testament naming clearance", "summary": "Dated trademark, package, repository, domain, standards, and similarity searches with residual risk.", "state": "accepted", "version": "1.0.0", "commit": "534d1ae65e45dc2ab9ca3a00574109dcdc6bb022",
      "owner": {"role": "lead maintainer", "identity": "Eno Reyes (@enoreyes)"}, "dependencies": [], "acceptance_criteria": ["Every required search class has an attributable public source, access date, observation, inference, and residual risk.", "Review and conditional approval identify their accountable actors and limits."], "artifact": {"path": "docs/research/naming-clearance.md", "media_type": "text/markdown"},
      "evidence": [{"id": "EVID-NAMING-RECORD-001", "kind": "repository", "visibility": "public", "locator": "policy/naming-clearance.json", "claim_supported": "The machine record contains dated searches, review, approval, and residual risk."}], "review": {"reviewer": "factory-droid[bot]", "role": "research worker; not trademark counsel", "status": "completed", "reviewed_at": "2026-08-21"}, "decision": {"status": "approved", "authority": "Eno Reyes (@enoreyes), lead maintainer", "decided_at": "2026-08-21", "rationale": "Limited continued use is supported by the public foundation decision and explicit conditions."}, "lineage": {"supersedes": null, "superseded_by": null}
    },
    {
      "id": "RES-STUDY-TRACE-LANDSCAPE-001", "type": "study", "title": "Trace-format landscape", "summary": "Provider, framework, observability, transport, projection, unknown-field, and lossiness research.", "state": "in-review", "version": "0.2.0", "commit": "a7fb6fad29b95f278e79af9efdaebd560adb0f94",
      "owner": {"role": "standards maintainer", "identity": "Eno Reyes (@enoreyes)"}, "dependencies": ["RES-STUDY-NAMING-001"], "acceptance_criteria": ["Every named ecosystem has dated sources, samples, conclusions, and open questions.", "Transport bytes, projections, unknown fields, and lossiness remain distinct."], "artifact": {"path": "docs/research/studies/trace-landscape.md", "media_type": "text/markdown"}, "evidence": [{"id": "EVID-TRACE-STUDY", "kind": "repository", "visibility": "public", "locator": "docs/research/studies/trace-landscape.md", "claim_supported": "The public study states methods, findings, contradictions, limitations, sample plans, and open questions."}, {"id": "EVID-TRACE-MATRIX", "kind": "repository", "visibility": "public", "locator": "policy/trace-landscape.json", "claim_supported": "The machine-readable matrix gives exact ecosystem coverage and dated, claim-specific public sources."}], "review": {"reviewer": "non-author interoperability reviewer", "role": "required reviewer", "status": "pending", "reviewed_at": null}, "decision": {"status": "pending", "authority": "Testament maintainers", "decided_at": null, "rationale": "Research artifact is complete and awaiting independent review."}, "lineage": {"supersedes": null, "superseded_by": null}
    },
    {
      "id": "RES-STUDY-ABUSE-MISUSE-001", "type": "study", "title": "Abuse and misuse research", "summary": "Timing, harm, signals, authorized-use twins, false positives, appeals, and reviewer limits.", "state": "in-review", "version": "0.2.0", "commit": "a7fb6fad29b95f278e79af9efdaebd560adb0f94",
      "owner": {"role": "security maintainer", "identity": "Eno Reyes (@enoreyes)"}, "dependencies": ["RES-STUDY-TRACE-LANDSCAPE-001"], "acceptance_criteria": ["Online, nearline, and offline detection are distinct.", "Every required harm includes signals, counterexamples, review paths, and limits."], "artifact": {"path": "docs/research/studies/abuse-misuse.md", "media_type": "text/markdown"}, "evidence": [{"id": "EVID-ABUSE-STUDY", "kind": "repository", "visibility": "public", "locator": "docs/research/studies/abuse-misuse.md", "claim_supported": "The public study defines timing, counterexamples, review, appeals, false positives, limits, and open questions."}, {"id": "EVID-ABUSE-MATRIX", "kind": "repository", "visibility": "public", "locator": "policy/abuse-misuse-research.json", "claim_supported": "The machine-readable matrix maps every required risk to signals, timing, authorized-use twins, reviewers, and dated sources."}], "review": {"reviewer": "non-author security reviewer", "role": "required reviewer", "status": "pending", "reviewed_at": null}, "decision": {"status": "pending", "authority": "Testament maintainers", "decided_at": null, "rationale": "Research artifact is complete and awaiting independent review."}, "lineage": {"supersedes": null, "superseded_by": null}
    },
    {
      "id": "RES-STUDY-STRIDE-001", "type": "study", "title": "STRIDE threat model", "summary": "Stable spoofing, tampering, repudiation, disclosure, denial, and elevation threats.", "state": "in-review", "version": "0.2.0", "commit": "4ec9023219aff0a9a3c9c058af4f15138e362e78",
      "owner": {"role": "security maintainer", "identity": "Eno Reyes (@enoreyes)"}, "dependencies": ["RES-STUDY-TRACE-LANDSCAPE-001"], "acceptance_criteria": ["Every threat maps assets, actors, boundaries, preconditions, mitigation, validation, owner, and residual risk."], "artifact": {"path": "docs/research/threats/stride.md", "media_type": "text/markdown"},
      "evidence": [{"id": "EVID-STRIDE-STUDY", "kind": "repository", "visibility": "public", "locator": "docs/research/threats/stride.md", "claim_supported": "The public stride threat model states scope, mappings, evidence, limits, and open research status."}, {"id": "EVID-STRIDE-MATRIX", "kind": "repository", "visibility": "public", "locator": "policy/threat-privacy-sovereignty.json", "claim_supported": "The schema-validated VAL-READY-010 matrix binds stable threats, data, boundaries, controls, validations, attack leaves, profiles, lifecycle, key custody, sources, and limitations."}], "review": {"reviewer": "non-author security and privacy reviewer", "role": "required independent reviewer", "status": "pending", "reviewed_at": null}, "decision": {"status": "pending", "authority": "Testament maintainers", "decided_at": null, "rationale": "Research artifact is complete, security-critique blockers were remediated, and independent review remains required before acceptance."}, "lineage": {"supersedes": null, "superseded_by": null}
    },
    {
      "id": "RES-STUDY-LINDDUN-001", "type": "study", "title": "LINDDUN privacy model", "summary": "Stable privacy threats for evidence, identity, storage, analysis, and review paths.", "state": "in-review", "version": "0.2.0", "commit": "4ec9023219aff0a9a3c9c058af4f15138e362e78",
      "owner": {"role": "security maintainer", "identity": "Eno Reyes (@enoreyes)"}, "dependencies": ["RES-STUDY-DATA-INVENTORY-001"], "acceptance_criteria": ["Every privacy threat maps data, actors, boundary, preconditions, mitigation, validation, owner, and residual risk."], "artifact": {"path": "docs/research/threats/linddun.md", "media_type": "text/markdown"},
      "evidence": [{"id": "EVID-LINDDUN-STUDY", "kind": "repository", "visibility": "public", "locator": "docs/research/threats/linddun.md", "claim_supported": "The public linddun privacy model states scope, mappings, evidence, limits, and open research status."}, {"id": "EVID-LINDDUN-MATRIX", "kind": "repository", "visibility": "public", "locator": "policy/threat-privacy-sovereignty.json", "claim_supported": "The schema-validated VAL-READY-010 matrix binds stable threats, data, boundaries, controls, validations, attack leaves, profiles, lifecycle, key custody, sources, and limitations."}], "review": {"reviewer": "non-author security and privacy reviewer", "role": "required independent reviewer", "status": "pending", "reviewed_at": null}, "decision": {"status": "pending", "authority": "Testament maintainers", "decided_at": null, "rationale": "Research artifact is complete, security-critique blockers were remediated, and independent review remains required before acceptance."}, "lineage": {"supersedes": null, "superseded_by": null}
    },
    {
      "id": "RES-STUDY-ATTACK-TREES-001", "type": "study", "title": "Attack trees", "summary": "Attack paths across ingest, storage, analyzers, policy, operators, CI, and recovery.", "state": "in-review", "version": "0.2.0", "commit": "4ec9023219aff0a9a3c9c058af4f15138e362e78",
      "owner": {"role": "security maintainer", "identity": "Eno Reyes (@enoreyes)"}, "dependencies": ["RES-STUDY-STRIDE-001", "RES-STUDY-LINDDUN-001"], "acceptance_criteria": ["Attack goals and branches resolve to stable threats, mitigations, tests, owners, and residual risk."], "artifact": {"path": "docs/research/threats/attack-trees.md", "media_type": "text/markdown"},